### ISSUE TITLE
discosrv as of today does not answer UDP packets correctly

### ISSUE THREAD

**Issue by midnightmagic** [syncthing/discosrv#12]
discosrv when left to its own devices on a multi-homed machine with multiple reachable IP addresses does not answer using the IP it was initially contacted on. See the following tcpdump for an example:

16:11:11.122742 IP 10.0.0.66.53198 > 10.0.0.1.22026: UDP, length 56
16:11:12.135427 IP 10.0.0.66.57178 > 10.0.0.1.22026: UDP, length 40
16:11:12.179739 IP 10.0.0.10.22026 > 10.0.0.66.57178: UDP, length 60
16:12:17.134918 IP 10.0.0.66.53198 > 10.0.0.1.22026: UDP, length 56

Note that it is being *contacted* on 10.0.0.1 but it is *answering* from 10.0.0.10.

Obviously, IP addresses changed for the sake of my privacy.

Temporary workaround is to provide the -i flag to discosrv to force it to listen on the appropriate IP address instead of the wildcard.

Sources checked out as of commitid:

4c705ff8881c3505cba47fd6f8cee1b76a0f4f4d

Probably the easiest way to test this (which I haven't on my local network since I see it on my publically-facing server) is to assign an alias to your Linux machine on a local network with an additional IP and configure your syncthing to use the alias as a UDP4 global discovery server.

Thanks!

**Comment by calmh** [comment]
I'm not sure how this is an issue? By default any packet will go out according to the routing table and use the source interface as address. There's a flag to get more specific behavior if you want to bind to a virtual IP or alias...

**Comment by midnightmagic** [comment]
It is incorrect behaviour even by Linux' own connection-tracking behaviour in iptables. It is a fault to answer on an IP address which was not the one contacted. There are no daemons which function this way: they do not exist. This is why when you address an IP address that BIND is listening to, for example, you do not get an answer from a different IP address that is aliased to the same network.

Nor do client firewalls tolerate this behaviour; related packets and NAT traversal state keeping REQUIRE that the client initialize the connection state and the connection quad NOT be tampered with by the contacted server.

I challenge you to find a single UDP-based server anywhere which answers from a different IP address than the one initially contacted, nor is it correct networking behaviour on an IP aliased host with multiple publically-facing IP addresses. Yes, I found the -i flag, but this restricts the operational utility of the daemon.

If you still do not agree, I would be happy to find passages in major networking books, and build a list of UDP-based daemons whoch correctly maintain the socket quad identifier and list them in this issue for you.

Correct behaviour is to answer using the IP address contacted.

**Comment by calmh** [comment]
Yeah, ok.

**Comment by midnightmagic** [comment]
Thank you very much. I would be happy to do any testing you need, run any diagnostics you would like me to, or otherwise assist in whatever manner you think would be helpful.

**Comment by midnightmagic** [comment]
Uh. A friend pointed out I'm being rude.

I apologise for my choice of diction, there isn't really an excuse for being rude, and I guess sometimes it takes a third party to point it out.

fwiw at this point, I really like the software. :-)

**Comment by calmh** [comment]
:heart:

**Comment by AudriusButkevicius** [comment]
We now use HTTP, so this no longer applies.
